### ISSUE TITLE
Diagnosis complains about 1900 and 7359 ports exposure

### ISSUE THREAD

**Issue by xabirequejo** [YunoHost-Apps/jellyfin_ynh#173]
### Describe the bug

- YunoHost's diagnosis tool complains about ports 1900 and 7359, both regarding Jellyfin.
- The issue seems to be present since ~29th July, 2024.
- Android TV client cannot connect to the server, complains about SSL handshake and ports 8096 and 8920.

### Context

- Hardware: Raspberry Pi at home
- YunoHost version: 12.0.3 beta
- I have access to my server: Through SSH and through the webadmin
- Are you in a special context or did you perform some particular tweaking on your YunoHost instance?: no (boots from external drive?)
- Using, or trying to install package version/branch: 10.9.9~ynh2

### Steps to reproduce

- When opening a Jellyfin client, the client sees the local server, but can't connect to it when tapped. One must type the whole URL on the client in order to be able to connect to the server.
- This workaround works for pc browser, iOS and Android clients, but Android TV client is unable to connect, neither via discovered server nor typed URL. Android TV client shows three errors: SSL handshake, port 8096 and port 8920 (even after adding them to the firewall by hand).

(TLD where Jellyfin server is installed has valid Let's Encrypt SSL)

### Expected behavior

All clients to be able to connect to the server without issue.

**Comment by florentc** [comment]
I get diagnostic errors about these ports as well, on a yunohost hosted on a dedicated server.

**Comment by stilobique** [comment]
I've got this problem too, it's hard to know where the error is, on the Yuno firewall side?

**Comment by r-garciag** [comment]
Here I have the same problem. I cannot access the Jellyfin server through any apps (iOS, Android or FireTV)

**Comment by botagas** [comment]
In my case, the ports 1900 and 7359 are open (UDP), but I cannot see the server on any clients. I must type the URL:PORT directly. Seems like AutoDiscovery is broken.
I also did the following request to port 7359 to check for a response:
`socat - UDP4-DATAGRAM:192.168.1.145:7359,broadcast <<< 'Who is JellyfinServer?'`
And I did get a response:
`{"Address":"https://sub.domain.tld","Id":"redactedId","Name":"redactedName","EndpointAddress":null}`

Running the following SSDP query:
`socat - UDP4-DATAGRAM:239.255.255.250:1900,broadcast <<< "M-SEARCH * HTTP/1.1\r\nHOST:239.255.255.250:1900\r\nMAN:\"ssdp:discover\"\r\nMX:3\r\nST:ssdp:all\r\n\r\n"`
Gives me nothing. 
At the same time running tcpdump on Jellyfin server (LXC on Proxmox with Firewall disabled), I see that the query was there:
`16:14:06.951767 IP 192.168.1.244.53875 > 192.168.1.145.1900: UDP, length 101`
However, there was no response. I do see Jellyfin advertising on 239.255.255.250:1900 here:
```
18:05:09.608139 IP 192.168.1.145.43057 > 239.255.255.250.1900: UDP, length 357
18:05:09.608139 IP 192.168.1.145.43057 > 239.255.255.250.1900: UDP, length 140
18:05:09.608186 IP 192.168.1.145.43057 > 239.255.255.250.1900: UDP, length 366
18:05:09.608229 IP 192.168.1.145.43057 > 239.255.255.250.1900: UDP, length 409
18:05:09.608271 IP 192.168.1.145.43057 > 239.255.255.250.1900: UDP, length 366
18:05:09.608306 IP 192.168.1.145.43057 > 239.255.255.250.1900: UDP, length 421
18:05:09.608343 IP 192.168.1.145.43057 > 239.255.255.250.1900: UDP, length 366
18:05:09.608378 IP 192.168.1.145.43057 > 239.255.255.250.1900: UDP, length 423
18:05:09.708353 IP 192.168.1.145.43057 > 239.255.255.250.1900: UDP, length 140
18:05:09.708366 IP 192.168.1.145.43057 > 239.255.255.250.1900: UDP, length 423
18:05:09.708373 IP 192.168.1.145.43057 > 239.255.255.250.1900: UDP, length 366
18:05:09.708393 IP 192.168.1.145.43057 > 239.255.255.250.1900: UDP, length 366
18:05:09.708399 IP 192.168.1.145.43057 > 239.255.255.250.1900: UDP, length 421
18:05:09.708404 IP 192.168.1.145.43057 > 239.255.255.250.1900: UDP, length 366
18:05:09.708409 IP 192.168.1.145.43057 > 239.255.255.250.1900: UDP, length 409
18:05:09.708413 IP 192.168.1.145.43057 > 239.255.255.250.1900: UDP, length 357
18:05:09.808518 IP 192.168.1.145.43057 > 239.255.255.250.1900: UDP, length 409
18:05:09.808521 IP 192.168.1.145.43057 > 239.255.255.250.1900: UDP, length 357
18:05:09.808534 IP 192.168.1.145.43057 > 239.255.255.250.1900: UDP, length 423
18:05:09.808537 IP 192.168.1.145.43057 > 239.255.255.250.1900: UDP, length 421
18:05:09.808549 IP 192.168.1.145.43057 > 239.255.255.250.1900: UDP, length 366
18:05:09.808560 IP 192.168.1.145.43057 > 239.255.255.250.1900: UDP, length 140
18:05:09.808565 IP 192.168.1.145.43057 > 239.255.255.250.1900: UDP, length 366
18:05:09.808569 IP 192.168.1.145.43057 > 239.255.255.250.1900: UDP, length 366
```
On my Mikrotik router, I am able to see the packets going from 192.168.1.145 to 239.255.255.250:1900 using Torch.


So AutoDiscovery seems to respond to direct queries, but probably fails due to SSDP not working properly?

**Comment by McGnomus** [comment]
I have the same issue: I can reach and use Jellyfin via the web browser (subdomain.mydomain.de/jellyfin) but not with any Jellyfin apps (tried the Jellyfin Android app, the Android TV app and Symfonium for Android).

The auto discovery seems to work: In the Symfonium app I see the raspberry pi that I installed Yunohost on. But connecting to it does not work, regardless of the ports or URL/IP I use...

Has anybody found a workaround? Or a different solution to access their Jellyfin in an app?
